day,challenge,categories,approved,active
1,"Name one emotion, resentment, or disappointment that has been taking up space, and give it one honest sentence.",healing|hope,true,true
2,"Choose one small grip to loosen today: a rule, a judgment, a timeline, or a need to control the outcome.",healing|peace,true,true
3,"Give one difficult feeling ninety seconds of kind attention before you try to solve anything.",wisdom|healing,true,true
4,"Write down one old pattern you are ready to stop rehearsing, then write the clean-slate choice beside it.",scripture|healing|hope,true,true
5,"Notice one recurring pressure or fear and ask, 'What belief is this trying to prove?'",identity|wisdom,true,true
6,"Replace one defeated question with a useful one, such as 'What is one truthful next step?'",scripture|wisdom|identity,true,true
7,"Turn one limiting belief into an honest affirmation that your nervous system can actually believe.",purpose|wisdom,true,true
8,"Repeat your new affirmation three times today, then take one tiny action that proves it.",courage|encouragement,true,true
9,"Before entering one draining space, set an intention for what energy belongs to you and what does not.",scripture|purpose|wisdom,true,true
10,"Practice one boundary that is simple, respectful, and clear.",identity|peace,true,true
11,"Choose one routine that supports steadiness: a breath, a note, a pause, a prayer, or a check-in.",peace|wisdom,true,true
12,"Take one action from calm authority instead of pressure, performance, or panic.",scripture|wisdom|identity,true,true
13,"Spend three quiet minutes asking for guidance, then write the first simple impression without arguing with it.",wisdom|identity,true,true
14,"Hold one possible next step in mind and notice whether your body feels contracted, neutral, or open.",scripture|identity|wisdom,true,true
15,"Act on one small intuitive nudge that is kind, grounded, and aligned.",courage|peace,true,true
16,"Create one quiet opening today where guidance, clarity, or support can reach you.",scripture|purpose|wisdom,true,true
17,"Identify one thought or habit that makes abundance feel unsafe, unavailable, or undeserved.",healing|identity,true,true
18,"Ask for one form of support today: practical, emotional, spiritual, or relational.",healing|peace,true,true
19,"When something good arrives today, pause before minimizing it and let it register.",hope|peace,true,true
20,"Choose one generous thought about your future, your resources, or your ability to be supported.",hope|wisdom,true,true
21,"Notice three things today: what energizes you, what depletes you, and what brings you back to center.",purpose|peace,true,true
22,"Choose one action that reflects your actual priority, not the loudest demand.",scripture|purpose|wisdom,true,true
23,"Pick the one next step that gives the best return for your life, energy, or purpose today.",wisdom|purpose,true,true
24,"Remove, delay, or delegate one low-alignment task so there is room for what matters.",wisdom|purpose,true,true
25,"List three gifts, abilities, or forms of wisdom that feel natural enough you sometimes overlook them.",scripture|identity|wisdom,true,true
26,"Identify one resource you already have: a relationship, skill, experience, insight, tool, or opportunity.",purpose|encouragement,true,true
27,"Act today as if your presence, gifts, and choices genuinely matter.",encouragement|purpose,true,true
28,"Use one existing gift or resource today instead of waiting for a perfect condition.",scripture|purpose|wisdom,true,true
29,"Write five words that describe who you are beneath roles, pressure, and performance.",identity|healing,true,true
30,"Let your practical mind and spiritual knowing both respond to one decision before you choose.",identity|wisdom,true,true
31,"Notice what feels alive, meaningful, or quietly magnetic, then take one respectful step toward it.",purpose|identity,true,true
32,"Celebrate one trait, sensitivity, story, or way of seeing that makes your path your own.",scripture|courage|peace,true,true
33,"Name one way your natural gifts could meet a real need in another person's life.",purpose|encouragement,true,true
34,"Reflect on one way money can represent value exchanged, needs met, and gifts put into motion.",encouragement|hope,true,true
35,"Offer something today from overflow, clarity, or real willingness instead of proving yourself.",scripture|courage|peace,true,true
36,"Write one sentence about what more support, money, time, or energy would allow you to create or contribute.",purpose|encouragement,true,true
37,"List the three tools from this journey that helped you most: release, questions, intuition, boundaries, priorities, support, or service.",scripture|perseverance|wisdom,true,true
38,"Choose one recurring check-in that will keep your growth alive after day forty.",scripture|hope|perseverance,true,true
39,"Name three ways you are not relating to yourself, abundance, or purpose the way you did before.",courage|encouragement,true,true
40,"Write one grounded next step and one blessing over the person you are continuing to become.",hope|purpose,true,true
